Format Name,Description,Use Cases,Pros,Cons
Accordion,"Collapsible panels that expand to reveal content, such as photos or text.",Compact display of categories or step-by-step guides.,"Space-saving, interactive, and organized.",Can become cluttered if overused; may require JavaScript for advanced functionality.
Card Layout,"Self-contained blocks of content (e.g., image, title, text, and button).","Presenting products, blog summaries, or team profiles.","Modular, reusable, responsive-friendly.",Overuse can make layouts monotonous.
Carousel/Slider,"Rotating set of images or content blocks, often with navigation arrows or dots.","Highlighting featured images, products, or announcements.","Visually appealing, can highlight multiple elements in limited space.",Risk of poor usability if slides move too quickly; not ideal for SEO.
Fullscreen Sections,"Each section occupies the entire viewport, navigated via scroll or clicks.","Portfolios, presentations, or storytelling websites.","High impact, smooth transitions enhance UX.",Requires careful design for responsive devices.
Grid Layout,"Items organized into rows and columns, often using CSS Grid or Flexbox.","Showcasing portfolios, photo galleries, or product listings.","Highly customizable, responsive design possible.",Requires careful planning for responsive layouts.
Hero Banner,"A large, full-width image or video at the top of the page, often with text overlay.",Drawing attention to key messages or promotions.,"High visual impact, effective for branding.",Can slow down page load time; requires optimization for mobile.
List/Stacked Content,"Sequential display of content, often in vertical order.","Blogs, forums, or content-heavy sites.","Simple, straightforward, good for SEO.",Can appear plain or uninspired without design enhancements.
Masonry Layout,A Pinterest-style layout where items of varying sizes fit together like a puzzle.,"Displaying photo galleries, blog posts, or portfolios.","Maximizes use of space, visually interesting.",Requires JavaScript for seamless responsiveness.
Parallax Scrolling,"Background images move slower than foreground content, creating a 3D-like effect.","Landing pages, creative storytelling, or portfolio showcases.",Visually engaging; adds depth to the design.,Can impact performance; not ideal for text-heavy sites.
Sidebar Layout,A main content area with a fixed or collapsible sidebar for navigation or additional info.,"News websites, blogs, and dashboards.",Allows clear separation of main and secondary content.,Sidebars can distract from the main content.
Single Page Scroll,"All content displayed on one page, often with smooth scrolling between sections.","Storytelling, portfolios, or minimalist websites.","Seamless experience, ideal for smaller content websites.",Not suitable for content-heavy sites; challenging SEO.
Split Screen,"Page divided into two sections (vertical or horizontal), each with separate content or imagery.","Contrasting two key ideas, highlighting dual features, or storytelling.","Striking and modern aesthetic, good for comparisons.",Can be overwhelming on small screens.
Sticky Header/Footer,Fixed elements at the top or bottom of the page for navigation or key actions.,"Blogs, e-commerce sites, or dashboards with frequent navigation needs.",Always accessible navigation; improves user experience.,Can consume valuable screen real estate on smaller devices.
Tabbed Interface,"Content divided into tabs, each displaying a different section of information when clicked.","Organizing related content, like FAQs or product specifications.","Keeps content organized, user-friendly navigation.","Can be confusing for accessibility (screen readers, etc.)."
Timeline Layout,"Chronological presentation of events, often in vertical or horizontal format.","Showcasing histories, project roadmaps, or personal journeys.","Visual representation of chronological data, interactive potential.",Limited use cases outside of timelines.
